13	ACM Conference on Computer Supported Cooperative Work	CSCW	CORE2014	A	No	806		
16	ACM Conference on Embedded Software	EMSOFT	CORE2014	A	No	1005		
17	ACM Conference on Hypertext and Hypermedia	Hypertext	CORE2014	A	Yes	805	806	
24	ACM International Conference on Emerging Networking Experiments and Technologies	CoNEXT	CORE2014	A	No	805		
25	ACM International Conference on Information and Knowledge Management	CIKM	CORE2014	A	Yes	806	807	
1488	ACM International Conference on Interactive Surfaces and Spaces (was International Workshop on Horizontal Interactive Human-Computer Systems: Tabletop)	ISS	CORE2014	A	Yes	806		
30	ACM International Conference on Supercomputing	ICS	CORE2014	A	Yes	805		
33	ACM International Symposium on High Performance Distributed Computing	HPDC	CORE2014	A	No	805		
49	ACM SIGPLAN Conference on Languages, Tools, and Compilers for Embedded Systems	LCTES	CORE2014	A	No	1005		
55	ACM Special Interest Group on Computer Science Education Conference	SIGCSE	CORE2014	A	No	899		
58	ACM Symposium of Mobile and Ad Hoc Computing	MOBIHOC	CORE2014	A	No	804		
60	ACM Symposium on Computational Geometry	SCG	CORE2014	A	No	802		
2137	ACM Symposium on Software Reusability 	SSR	CORE2014	A	No	803		
66	ACM Symposium on User Interface Software and Technology	UIST	CORE2014	A	No	806		
67	ACM Virtual Reality Software and Technology	VRST	CORE2014	A	Yes	801		
69	ACM Workshop on Hot Topics in Networks	HOTNETS	CORE2014	A	No	1005		
76	ACM/IEEE International Conference on Modelling, Analysis and Simulation of Wireless and Mobile Systems	MSWIM	CORE2014	A	No	1006		
77	ACM/IEEE Supercomputing Conference	SC	CORE2014	A	No	805		
79	ACM/IFIP/USENIX International Middleware Conference	Middleware	CORE2014	A	No	803		
81	ACM/SPIE Multimedia Computing and Networking	MMCN	CORE2014	A	No	801		
97	Advances in Modal Logic	AiML	CORE2014	A	No	802		
1968	American Medical Informatics Annual Fall Symposium	AMIA	CORE2014	A	No	806		
115	Americas Conference on Information Systems	AMCIS	CORE2014	A	No	806		
117	Annual Computer Security Applications Conference	ACSAC	CORE2014	A	No	803		
120	Annual Conference of the Cognitive Science Society	CogSci	CORE2014	A	No	801		
123	Annual Conference of the International Speech Communication Association (was Eurospeech)	Interspeech	CORE2014	A	No	801		
126	Annual Conference on Innovation and Technology in Computer Science Education	ITiCSE	CORE2014	A	No	899		
139	AoM Organizational Communication and Information Systems	OCIS	CORE2014	A	No	806		
141	Application of Computers and Operations Research in the Minerals Industries	APCOMin	CORE2014	A	No	909	914	
150	Artificial Intelligence in Medicine	AIIM	CORE2014	A	No	801		
151	Artificial Intelligence in Medicine in Europe	AIME	CORE2014	A	Yes	801		
191	Aspect-Oriented Software Development	AOSD	CORE2014	A	No	803		
279	Automated Software Engineering Conference	ASE	CORE2014	A	Yes	803		
337	Computer Supported Collaborative Learning	CSCL	CORE2014	A	Yes	806		
1839	Conference on File and Storage Technologies	FAST	CORE2014	A	No	804		
369	Conference on Innovative Data Systems Research	CIDR	CORE2014	A	No	806		
370	Conference on Integer Programming and Combinatorial Optimization	IPCO	CORE2014	A	Yes	802		
1245	Conference on Interactive Theorem Proving (previously TPHOLs, changed in 2009)	ITP	CORE2014	A	No	802		
371	Conference on Natural Language Learning	CoNLL	CORE2014	A	No	801		
2004	Deductive and Object-Oriented Databases	DOOD	CORE2014	A	No	806		
1996	Design Automation Conf	DAC	CORE2014	A	No			
448	Empirical Methods in Natural Language Processing	EMNLP	CORE2014	A	No	801		
2011	Engineering Applications of Artifical Intelligence 	EAAI 	CORE2014	A	No	801		
463	Euromicro Conference on Real-Time Systems	ECRTS	CORE2014	A	No	1005		
468	European Association of Computational Linguistics	EACL	CORE2014	A	No	801		
473	European Conference on Artificial Intelligence	ECAI	CORE2014	A	No	801		
479	European Conference on Computer Vision	ECCV	CORE2014	A	No	801		
484	European Conference on Information Systems	ECIS	CORE2014	A	No	806		
486	European Conference on Machine Learning (Joined with PKDD from 2008)	ECML	CORE2014	A	No	801		
491	European Conference on Machine Learning and Principles and Practice of Knowledge Discovery in Database (PKDD and ECML combined from 2008)	ECML PKDD	CORE2014	A	Yes	804		
488	European Conference on Object-Oriented Programming	ECOOP	CORE2014	A	Yes	803		
2165	European Conference on Software Architecture	ECSA	CORE2014	A	Yes	803		
499	European Graphics Conference	EUROGRAPH	CORE2014	A	No	801		
52	European Software Engineering Conference and the ACM SIGSOFT Symposium on the Foundations of Software Engineering (duplicate was listed as ESEC, removed from DB)	ESEC/FSE	CORE2014	A	Yes	803		
511	European Symposium on Algorithms	ESA	CORE2014	A	No	802		
514	European Symposium on Programming	ESOP	CORE2014	A	No	803		
515	European Symposium On Research In Computer Security	ESORICS	CORE2014	A	No	803		
525	Eurosys Conference	EuroSys	CORE2014	A	No	803		
2021	Extended Semantic Web Conference (was European Semantic Web Conference)	ESWC	CORE2014	A	Yes	1005		
528	Extending Database Technology	EDBT	CORE2014	A	No	804		
540	Formal Methods Europe	FME	CORE2014	A	No	802		
547	Foundations of Software Science and Computational Structures	FOSSACS	CORE2014	A	Yes	803		
556	Genetic and Evolutionary Computations	GECCO	CORE2014	A	No	8	9	
572	Graph Drawing	GD	CORE2014	A	No	802		
575	Hawaii International Conference on System Sciences	HICSS	CORE2014	A	No	806		
597	IEEE Computational Systems Bioinformatics Conference	CSB	CORE2014	A	No	803		
599	IEEE Computer Security Foundations Symposium (was CSFW)	CSF	CORE2014	A	Yes	803		
604	IEEE Conference on Computer Vision and Pattern Recognition	CVPR	CORE2014	A	Yes	801		
605	IEEE Conference on Decision and Control	CDC	CORE2014	A	No	1005		
607	IEEE Conference on Local Computer Networks	LCN	CORE2014	A	No	1006		
2110	IEEE Conference on Open Architecture and Network Programming	OPENARCH	CORE2014	A	No	805		
632	IEEE International Conference on Cluster Computing	CLUSTER	CORE2014	A	No	805		
2045	IEEE International Conference on Computer Languages	ICCL	CORE2014	A	No	803		
2047	IEEE International Conference on Document Analysis and Recognition	ICDAR	CORE2014	A	Yes	806		
648	IEEE International Conference on e-Science and Grid Computing	e-Science	CORE2014	A	No	805		
646	IEEE International Conference on Engineering of Complex Computer Systems	ICECCS	CORE2014	A	No	1005		
649	IEEE International Conference on Fuzzy Systems	FUZZ-IEEE	CORE2014	A	No	801		
2063	IEEE International Conference on Multimedia Computing and Systems	ICMCS	CORE2014	A	No	806		
674	IEEE International Conference on Services Computing	SCC	CORE2014	A	No	806		
676	IEEE International Conference on Software Maintenance and Evolution (prior to 2014 was ICSM, IEEE International Conference on Software Maintenance)	ICSME	CORE2014	A	Yes	803		
678	IEEE International Conference on Web Services	ICWS	CORE2014	A	No	806		
685	IEEE International Joint Conference on Neural Networks	IJCNN	CORE2014	A	No	801		
688	IEEE International Parallel and Distributed Processing Symposium (was IPPS and SPDP)	IPDPS	CORE2014	A	Yes	805		
690	IEEE International Requirements Engineering Conference	RE	CORE2014	A	No	803		
2081	IEEE International Solid-State Circuits Conference	ISSCC	CORE2014	A	No			
691	IEEE International Symposium on a World of Wireless, Mobile and Multimedia Networks	WoWMoM	CORE2014	A	Yes	1006		
693	IEEE International Symposium on Artificial Life	IEEE Alife	CORE2014	A	No	801		
695	IEEE International Symposium on Cluster, Cloud and Grid Computing	CCGRID	CORE2014	A	No	805		
702	IEEE International Symposium on Network Computing and Applications	NCA	CORE2014	A	No	805		
2135	IEEE International Symposium on Software Metrics 	SMS 	CORE2014	A	No	803		
724	IEEE Pacific Visualization Symposium (was APVIS)	PacificVis	CORE2014	A	Yes	801		
725	IEEE Real-Time and Embedded Technology and Applications Symposium	RTAS	CORE2014	A	No	1006		
2026	IEEE Symposium on Field Programmable Custom Computing Machines	FCCM	CORE2014	A	No	803		
2064	IEEE Transactions on Knowledge and Data Engineering	IEEETKDE	CORE2014	A	No	806	801	
758	IEEE Virtual Reality Conference	VR	CORE2014	A	Yes	801		
759	IEEE Visualization	IEEE VIS	CORE2014	A	No	801		
763	IEEE Workshop on Applications of Computer Vision	WACV	CORE2014	A	No	801		
783	IEEE/ACM International Conference on Computer-Aided Design	ICCAD	CORE2014	A	No	801		
784	IEEE/ACM International Conference on Grid Computing	GRID	CORE2014	A	No	805		
787	IEEE/IFIP International Conference on Dependable Systems and Networks	DSN	CORE2014	A	Yes	803		
790	IEEE/IFIP International Symposium on Trusted Computing and Communications	TrustCom	CORE2014	A	No	803		
792	IEEE/RSJ International Conference on Intelligent Robots and Systems	IROS	CORE2014	A	No	913	910	801
2116	IFIP International Symposium on Computing Performance, Modelling, Measurement and Evaluation 	PERFORMANCE 	CORE2014	A	No	803		
805	IFIP Joint International Conference on Formal Description Techniques and Protocol Specification, Testing, And Verification	FORTE	CORE2014	A	Yes	803		
806	IFIP Networking 200X	Networking 200X	CORE2014	A	No	1006		
807	IFIP TC13 Conference on Human-Computer Interaction	Interact	CORE2014	A	Yes	806	1203	
2067	IFIP WG 11.3 Working Conference on Data and Applications Security (also known as DBSEC)	DBSEC	CORE2014	A	Yes	803	805	
812	IFIP/IEEE International Symposium on Integrated Management (odd years sharing with NOMS)	IM	CORE2014	A	No	1006		
845	Intelligent Data Analysis	IDA	CORE2014	A	No	804		
847	Intelligent Systems in Molecular Biology	ISMB	CORE2014	A	No	803		
864	International Colloquium on Automata Languages and Programming	ICALP	CORE2014	A	No	802		
2052	International Computer Symposium Conference	ICSC2	CORE2014	A	No			
878	International Conference in Business Process Management	BPM	CORE2014	A	No	806		
2040	International Conference of Asian Digital Libraries	ICADL	CORE2014	A	No			
1217	International Conference of Software and Systems Process (was ICSP prior to 2011)	ICSSP	CORE2014	A	No	803		
891	International Conference on Advanced Information Systems Engineering	CaiSE	CORE2014	A	No	806		
1960	International Conference on AI in Design	AID	CORE2014	A	No	801		
908	International Conference on Apps for Specific Array Processors	ASAP	CORE2014	A	No	805		
913	International Conference on Artificial Intelligence and Statistics	AISTATS	CORE2014	A	Yes	801		
1961	International Conference on Artificial Intelligence in Education	AIED	CORE2014	A	No	801		
918	International Conference on Automated Deduction	CADE	CORE2014	A	No	801		
936	International Conference on Compiler Construction	CC	CORE2014	A	No	803		
937	International Conference on Compilers, Architecture, and Synthesis for Embedded Systems	CASES	CORE2014	A	No	1006		
949	International Conference on Computational Linguistics	COLING	CORE2014	A	No	801		
952	International Conference on Computational Science	ICCS	CORE2014	A	Yes	802		
2038	International Conference on Computer Communication and Networks	ICCCN	CORE2014	A	No	805		
969	International Conference on Computing and Combinatorics	COCOON	CORE2014	A	No	802		
971	International Conference on Conceptual Modelling	ER	CORE2014	A	No	804		
973	International Conference on Concurrency Theory	CONCUR	CORE2014	A	No	802		
977	International Conference on Control, Automation, Robotics and Vision	ICARCV	CORE2014	A	No	801		
979	International Conference on Cooperative Information Systems	CoopIS	CORE2014	A	No	806		
980	International Conference on Coordination Models and Languages	Coordination	CORE2014	A	Yes	803		
989	International Conference on Database Theory	ICDT	CORE2014	A	No	804		
993	International Conference on Design Science Research in Information Systems and Technology	DESRIST	CORE2014	A	No	806		
1002	International Conference on Distributed Computing Systems	ICDCS	CORE2014	A	No	805		
497	International Conference on Embedded Wireless Systems and Networks (wasEuropean Conference on Wireless Sensor Networks)	EWSN	CORE2014	A	Yes	1005		
1022	International Conference on Evaluation and Assessment in Software Engineering	EASE	CORE2014	A	Yes	803		
1028	International Conference on Field and Service Robotics	FSR	CORE2014	A	No	801	910	
1033	International Conference on Formal Ontology in Information Systems	FOIS	CORE2014	A	Yes	806		
1034	International Conference on Foundation on Data Organization	FODO	CORE2014	A	No	804		
1048	International Conference on High Performance Computing	HiPC	CORE2014	A	Yes	805		
1080	International Conference on Information Systems Development	ISD	CORE2014	A	No	806		
1100	International Conference on Intelligent Tutoring Systems	ITS	CORE2014	A	No	801		
1101	International Conference on Intelligent User Interfaces	IUI	CORE2014	A	Yes	806		
1119	International Conference on Logic Programming	ICLP	CORE2014	A	No	802		
1120	International Conference on Logic Programming and Non-monotonic Reasoning	LPNMR	CORE2014	A	No	802		
1131	International Conference on Mobile and Ubiquitous Systems: Networks and Services	Mobiquitous	CORE2014	A	No	805		
1147	International Conference on Network Protocols	ICNP	CORE2014	A	No	1006		
1152	International Conference on Neural Information Processing	ICONIP	CORE2014	A	No	801		
1165	International Conference on Parallel Architecture and Compilation Techniques	PACT	CORE2014	A	No	805		
1167	International Conference on Parallel Processing	ICPP	CORE2014	A	Yes	805		
1175	International Conference on Principles and Practice of Constraint Programming	CP	CORE2014	A	No	803		
1191	International Conference on Reliable Software Technologies	Ada-Europe	CORE2014	A	Yes	803		
2123	International Conference on Rewriting Techniques and Applications (now merged with FSCD Formal Structures for Computation and Deduction)	RTA	CORE2014	A	No	802		
1197	International Conference on Scientific and Statistical Data Base Management	SSDBM	CORE2014	A	No	804		
1198	International Conference on Security and Privacy for Communication Networks	SecureComm	CORE2014	A	Yes	803		
1199	International Conference on Security in Pervasive Computing	ICSPC	CORE2014	A	No	806		
1204	International Conference on Service Oriented Computing	ICSOC	CORE2014	A	No	805		
791	International Conference on Software Architecture (was previously WICSA)	ICSA	CORE2014	A	Yes	803		
1220	International Conference on Software Reuse	ICSR	CORE2014	A	Yes	803		
1235	International Conference on Temporal Logic	ICTL	CORE2014	A	No	802		
1240	International Conference on the Simulation and Synthesis of Living Systems	ALIFE	CORE2014	A	No	801		
1243	International Conference on the Theory and Application of Cryptology and Information Security	ASIACRYPT	CORE2014	A	Yes	804		
1246	International Conference on Theorem Proving with Analytic Tableaux and Related Methods	TABLEAUX	CORE2014	A	No	802		
1250	International Conference on Theory and Applications of Satisfiability Testing	SAT	CORE2014	A	No	802		
2013	International Conference on Theory and Practice of Digital Libraries (was ECDL until 2010)	TPDL	CORE2014	A	Yes			
1262	International Conference on Virtual Execution Environments	VEE	CORE2014	A	No	803		
1271	International Conference on Web Information Systems Engineering	WISE	CORE2014	A	Yes	805		
2022	International European Conference on Parallel and Distributed Computing (was International Conference on Parallel Processing)	EuroPar	CORE2014	A	No			
1318	International Joint Conference on Qualitative and Quantitative Practical Reasoning	ESQARU	CORE2014	A	No	801		
2069	International Logic Programming Symposium	ILPS	CORE2014	A	No	801		
1338	International Semantic Web Conference	ISWC	CORE2014	A	Yes	804		
1349	International Symposium on Algorithms and Computation	ISAAC	CORE2014	A	Yes	802		
1357	International Symposium on Automated Technology for Verification and Analysis	ATVA	CORE2014	A	No	803		
1362	International Symposium on Code Generation and Optimization	CGO	CORE2014	A	No	803		
1374	International Symposium on Distributed Computing (was WDAG)	DISC	CORE2014	A	No	805		
1376	International Symposium on Empirical Software Engineering and Measurement	ESEM	CORE2014	A	Yes	803		
1382	International Symposium on Functional and Logic Programming	FLOPS	CORE2014	A	No	802		
1383	International Symposium on Fundamentals of Computation Theory	FCT	CORE2014	A	No	802		
1398	International Symposium on Mathematical Foundations of Computer Science	MFCS	CORE2014	A	Yes	802		
1400	International Symposium on Memory Management	ISMM	CORE2014	A	No	803		
2098	International Symposium on Microarchitecture	MICRO	CORE2014	A	No	803		
1409	International Symposium on Robotics	ISR	CORE2014	A	No	801	910	
1410	International Symposium on Robotics Research	ISRR	CORE2014	A	No	910	801	
1411	International Symposium on Software Reliability Engineering	ISSRE	CORE2014	A	Yes	803		
1412	International Symposium on Software Testing and Analysis	ISSTA	CORE2014	A	Yes	803		
1416	International Symposium on Spatial Databases	SSTD	CORE2014	A	Yes	804	909	
1451	International Workshop on Approximation Algorithms for Combinatorial Optimization Problems	APPROX	CORE2014	A	Yes	802		
1484	International Workshop on Graph-Theoretic Concepts in Computer Science	WG	CORE2014	A	Yes	802		
1518	International Workshop on Randomization and Computation	RANDOM	CORE2014	A	No	802		
1529	International Workshop on Software and Compilers for Embedded Systems	SCOPES	CORE2014	A	No	1005		
1551	Internet Measurement Conference	IMC	CORE2014	A	No	806		
494	Interspeech (combined EuroSpeech and ICSLP in 2000)	Interspeech	CORE2014	A	No	801		
1582	Knowledge capture	K-CAP	CORE2014	A	No	804		
1596	Logic Programming and Automated Reasoning	LPAR	CORE2014	A	No	802		
1598	Logics in Artificial Intelligence, European Conference	JELIA	CORE2014	A	No	802		
1607	Medical Image Computing and Computer-Assisted Intervention	MICCAI	CORE2014	A	No	801	903	
2104	Net Object Days (Includings MATES, ENASE etc.)	MATES ENASE	CORE2014	A	No			
1638	Network and OS Support for Digital A/V	NOSSDAV	CORE2014	A	No	806		
2105	Network Storage Symposium	NetStore	CORE2014	A	No	805		
1648	North American Association for Computational Linguistics	NAACL	CORE2014	A	No	801		
1657	Pacific Asia Conference on Information Systems	PACIS	CORE2014	A	No	806		
1660	Pacific Conference on Computer Graphics and Applications	PG	CORE2014	A	No	801		
1667	Pacific-Asia Conference on Knowledge Discovery and Data Mining	PAKDD	CORE2014	A	Yes	804		
1676	Parallel Problem Solving from Nature	PPSN	CORE2014	A	No	801		
2120	Performance Tools - International Conference on Model Techniques & Tools for CPE	PT	CORE2014	A	No	803		
1691	Principles and Practice of Parallel Programming	PPoPP	CORE2014	A	No	805		
1727	SIAM International Conference on Data Mining	SDM	CORE2014	A	No	804		
2136	Software Process Improvement and Capability Determination 	SPICE 	CORE2014	A	Yes	803		
1763	Static Analysis Symposium	SAS	CORE2014	A	Yes	802		
1766	Structural and Syntactical Pattern Recognition	SSPR	CORE2014	A	No	802		
1770	Symposia on VLSI Technology and Circuits	VLSI	CORE2014	A	No	1005		
1771	Symposium Model Analysis and Simulation of Computer and Telecommunications Systems	MASCOTS	CORE2014	A	No	1006		
2093	Symposium on Frontiers of Massively Parallel Processing	MassPar	CORE2014	A	No	805		
2033	Symposium on High Performance Chips 	HOTCHIPS (HCS) 	CORE2014	A	No			
1790	Symposium on Parallelism in Algorithms and Architectures	SPAA	CORE2014	A	No	805		
1792	Symposium on Reliable Distributed Systems	SRDS	CORE2014	A	No	805		
1798	Tangible, Embedded, and Embodied Interaction	TEI	CORE2014	A	No	806		
1408	The International Symposium on Research in Attacks, Intrusions and Defenses (was International Symposium on Recent Advances in Intrusion Detection)	RAID	CORE2014	A	Yes	804		
1814	Theoretical Aspects of Rationality and Knowledge	TARK	CORE2014	A	No	802		
1815	Theory of Cryptography Conference	TCC	CORE2014	A	Yes	804		
1818	Tools and Algorithms for Construction and Analysis of Systems	TACAS	CORE2014	A	No	803		
2144	Unix Symposium on Internet Technologies	USITS	CORE2014	A	No	805		
2124	Unix Symposium on Operating Systems Design and Implementation 	SDSDI 	CORE2014	A	No	803		
1838	Usenix Annual Technical Conference	USENIX	CORE2014	A	No	8		
1840	Usenix Network and Distributed System Security Symposium	NDSS	CORE2014	A	Yes	803	805	
1845	USENIX Workshop on Hot Topics in Operating Systems	HotOS	CORE2014	A	No	803		
1870	Workshop on Algorithm Engineering and Experiments	ALENEX	CORE2014	A	No	802		
11	ACM Conference on Applications, Technologies, Architectures, and Protocols for Computer Communication	SIGCOMM	CORE2014	A*	No	803		
12	ACM Conference on Computer and Communications Security	CCS	CORE2014	A*	Yes	803		
2085	ACM Conference on Digital Libraries 	JCDL 	CORE2014	A*	No	806		
15	ACM Conference on Embedded Networked Sensor Systems	SENSYS	CORE2014	A*	Yes	1006		
18	ACM Conference on Object Oriented Programming Systems Languages and Applications	OOPSLA	CORE2014	A*	Yes	803		
26	ACM International Conference on Knowledge Discovery and Data Mining	SIGKDD	CORE2014	A*	No	804		
27	ACM International Conference on Mobile Computing and Networking	MOBICOM	CORE2014	A*	No	1006		
29	ACM International Conference on Research and Development in Information Retrieval	SIGIR	CORE2014	A*	Yes	806	807	
31	ACM International Conference on Web Search and Data Mining	WSDM	CORE2014	A*	Yes	804	805	807
1825	ACM International Joint Conference on Pervasive and Ubiquitous Computing (PERVASIVE and UbiComp combined from 2013)	UbiComp	CORE2014	A*	No	805		
32	ACM International Symposium on Computer Architecture	ISCA	CORE2014	A*	No	803		
37	ACM Multimedia	ACMMM	CORE2014	A*	No	803	1203	
38	ACM SIG International Conference on Computer Graphics and Interactive Techniques	SIGGRAPH	CORE2014	A*	No	801		
39	ACM SIG on Computer and Communications Metrics and Performance	SIGMETRICS	CORE2014	A*	No	1006		
46	ACM SIGMOD-SIGACT-SIGART Conference on Principles of Database Systems	PODS	CORE2014	A*	No	804		
48	ACM SIGOPS Symposium on Operating Systems Principles	SOSP	CORE2014	A*	No	803		
56	ACM Special Interest Group on Management of Data Conference	SIGMOD	CORE2014	A*	No	804		
63	ACM Symposium on Principles of Distributed Computing	PODC	CORE2014	A*	No	805		
65	ACM Symposium on Theory of Computing	STOC	CORE2014	A*	No	802		
82	ACM-SIGACT Symposium on Principles of Programming Languages	POPL	CORE2014	A*	No	803		
84	ACM-SIGPLAN Conference on Programming Language Design and Implementation	PLDI	CORE2014	A*	No	803		
80	ACM/SIAM Symposium on Discrete Algorithms	SODA	CORE2014	A*	No	802		
94	Advances in Cryptology	CRYPTO	CORE2014	A*	No	804		
98	Advances in Neural Information Processing Systems	NIPS	CORE2014	A*	No	801		
124	Annual Conference on Computational Learning Theory	COLT	CORE2014	A*	No	801		
147	Architectural Support for Programming Languages and Operating Systems	ASPLOS	CORE2014	A*	No	803		
196	Association of Computational Linguistics	ACL	CORE2014	A*	No	801		
331	Computer Aided Verification	CAV	CORE2014	A*	Yes	802		
346	Conference in Uncertainty in Artificial Intelligence	UAI	CORE2014	A*	Yes	801		
408	Data Compression Conference	DCC	CORE2014	A*	No	804		
546	Foundations of Genetic Algorithms	FOGA	CORE2014	A*	No	801		
623	IEEE Information Visualization Conference	IEEE InfoVis	CORE2014	A*	No	801	806	
2074	IEEE International Conference on Computer Communications	INFOCOM	CORE2014	A*	No	805		
638	IEEE International Conference on Computer Vision	ICCV	CORE2014	A*	Yes	801		
642	IEEE International Conference on Data Mining	ICDM	CORE2014	A*	No	804		
669	IEEE International Conference on Pervasive Computing and Communications	PERCOM	CORE2014	A*	No	805		
708	IEEE International Symposium on Wearable Computing	ISWC	CORE2014	A*	No	806		
745	IEEE Symposium on Foundations of Computer Science	FOCS	CORE2014	A*	No	802		
748	IEEE Symposium on Logic in Computer Science	LICS	CORE2014	A*	No	802		
750	IEEE Symposium on Security and Privacy	S&P	CORE2014	A*	Yes	802	803	
785	IEEE/ACM International Symposium on Mixed and Augmented Reality	ISMAR	CORE2014	A*	No	801		
823	Information Processing in Sensor Networks	IPSN	CORE2014	A*	Yes	1006		
919	International Conference on Automated Planning and Scheduling	ICAPS	CORE2014	A*	Yes	801		
986	International Conference on Data Engineering	ICDE	CORE2014	A*	No	804		
1037	International Conference on Functional Programming	ICFP	CORE2014	A*	Yes	803		
1053	International Conference on Human Factors in Computing Systems	CHI	CORE2014	A*	No	806	1203	
1078	International Conference on Information Systems	ICIS	CORE2014	A*	Yes	806		
1121	International Conference on Machine Learning	ICML	CORE2014	A*	No	801		
1171	International Conference on Pervasive Computing (Joined with UbiComp from 2013)	PERVASIVE	CORE2014	A*	No	805	1203	
1209	International Conference on Software Engineering	ICSE	CORE2014	A*	Yes	803		
1239	International Conference on the Principles of Knowledge Representation and Reasoning	KR	CORE2014	A*	No	801	802	
1242	International Conference on the Theory and Application of Cryptographic Techniques	EuroCrypt	CORE2014	A*	No	804		
1261	International Conference on Very Large Databases	VLDB	CORE2014	A*	No	804		
1313	International Joint Conference on Artificial Intelligence	IJCAI	CORE2014	A*	No	801		
1314	International Joint Conference on Automated Reasoning	IJCAR	CORE2014	A*	No	801		
922	International Joint Conference on Autonomous Agents and Multiagent Systems (previously the International Conference on Multiagent Systems, ICMAS, changed in 2000)	AAMAS	CORE2014	A*	Yes	801		
1386	International Symposium on High Performance Computer Architecture	HPCA	CORE2014	A*	No	803		
1420	International Symposium on Symbolic and Algebraic Computation	ISSAC	CORE2014	A*	No	802		
1548	International World Wide Web Conference	WWW	CORE2014	A*	Yes	805	806	807
1629	National Conference of the American Association for Artificial Intelligence	AAAI	CORE2014	A*	No	801		
1701	Real Time Systems Symposium	RTSS	CORE2014	A*	No	1006		
1709	Robotics: Systems and Science	RSS	CORE2014	A*	No	801		
1841	Usenix Security Symposium	USENIX-Security	CORE2014	A*	Yes	803		
