1254	International Conference on Ubiquitous and Intelligence Computing	UIC	CORE2014	B	Yes	801		
1259	International Conference on User Modelling, Adaptation, and Personalization (was AH and UM)	UMAP	CORE2014	B	Yes	806		
1264	International Conference on Virtual Systems and MultiMedia	VSMM	CORE2014	B	No	806	1203	
1269	International Conference on Web Engineering	ICWE	CORE2014	B	Yes	806		
1280	International Conferences in Central Europe on Computer Graphics, Visualization and Computer Vision	WSCG	CORE2014	B	No	801		
1297	International Database Engineering and Applications Symposium	IDEAS	CORE2014	B	No	804		
1302	International Frontiers of Algorithmics Workshop	FAW	CORE2014	B	No	802		
1303	International Fuzzy Logic and Intelligent technologies in Nuclear Science Conference	FLINS	CORE2014	B	No	801		
2068	International Joint Conference on Computational Linguistics	IJCNLP2	CORE2014	B	No			
1317	International Joint Conference on Natural Language Processing	IJCNLP	CORE2014	B	No	801		
1260	International Meeting on High Performance Computing for Computational Science (previously International Meeting Vector and Parallel Processing, changed in 2002)	VECPAR	CORE2014	B	No	805		
1327	International Natural Language Generation Conference	INLG	CORE2014	B	No	801		
1341	International Symposium Component-Based Software Engineering	CBSE	CORE2014	B	Yes	803		
1345	International Symposium on Advanced DB Technologies and Integration	ADTI	CORE2014	B	No	804		
1348	International Symposium on Algorithmic Game Theory	SAGT	CORE2014	B	No	802		
1351	International Symposium on Applied Algebra, Algebraic Algorithms and Error-Correcting Codes	AAAAECC	CORE2014	B	No	802		
1354	International Symposium on Artificial Intelligence and Mathematics	ISAIM	CORE2014	B	Yes	801	802	
1368	International Symposium on Computational Life Science	CompLife	CORE2014	B	No	801		
1370	International Symposium on Computer Architecture and High Performance Computing	SBAC-PAD	CORE2014	B	No	805		
696	International Symposium on Distributed Simulation and Real Time Applications	DS-RT	CORE2014	B	No	805	806	
1375	International Symposium on Empirical Software Engineering	ISESE	CORE2014	B	No	803		
1378	International Symposium on Experimental Algorithms	SEA	CORE2014	B	No	802		
1390	International Symposium on Information Theory and Its Applications	ISITA	CORE2014	B	No	804		
1395	International Symposium on Latin American Theoretical Informatics	LATIN	CORE2014	B	No	802		
1397	International Symposium on Logic-based Program Synthesis and Transformation	LOPSTR	CORE2014	B	No	802		
1399	International Symposium on Mathematical Morphology	ISMM	CORE2014	B	No	801		
1401	International Symposium on Modelling and Optimization in Mobile, Ad Hoc, and Wireless Networks	WiOpt	CORE2014	B	No	1006		
1406	International Symposium on Parallel Architectures, Algorithms and Networks	I-SPAN	CORE2014	B	No	805		
1510	International Symposium on Parameterized and Exact Computation (was IWPEC pre 2004)	IPEC	CORE2014	B	No	802		
1418	International Symposium on String Processing and Information Retrieval	SPIRE	CORE2014	B	Yes	804	807	
1424	International Symposium on Temporal Representation and Reasoning	TIME	CORE2014	B	Yes	802		
1426	International Symposium on Theoretical Aspects of Computer Science	STACS	CORE2014	B	Yes	802		
1432	International Symposiums on Wikis	WIKISYM	CORE2014	B	No	803		
1440	International Work-Conference on Artificial and Natural Neural Networks	IWANN	CORE2014	B	No	801		
1446	International Workshop on Agents and Data Mining Interaction	ADMI	CORE2014	B	No	801		
1450	International Workshop on Ant Colony	ANTS	CORE2014	B	No	801		
2149	International Workshop on Artificial Intelligence and Statistics	WAIS	CORE2014	B	No			
1457	International Workshop on Coding and Cryptography	WCC	CORE2014	B	No	804		
1459	International Workshop on Combinatorial Algorithm	IWOCA	CORE2014	B	No	802		
1462	International Workshop on Computer-Aided Software Eng	IWCASE	CORE2014	B	No	803		
2160	International Workshop on Coordination, Organizations, Institutions, Norms and Ethics for Governance of Multi-Agent Systems (Ethics added 2020)	COINE	CORE2014	B	Yes	801		
1464	International Workshop on Data Warehousing and OLAP	DOLAP	CORE2014	B	No	804		
1998	International Workshop on Document Analysis Systems	DAS	CORE2014	B	Yes	801		
1470	International Workshop on Efficient Algorithms	WEA	CORE2014	B	No	802		
1475	International Workshop on Fast Software Encryption	FSE	CORE2014	B	Yes	804		
2091	International Workshop on Logic Programming and Multi-Agents	LPMA	CORE2014	B	No			
1508	International Workshop on Multimedia Signal Processing	MMSP	CORE2014	B	No	1006		
1511	International Workshop on Paraphrasing	IWP	CORE2014	B	No	801		
1512	International Workshop on Parsing Technologies	IWPT	CORE2014	B	Yes	803		
1520	International Workshop on Requirements Engineering Visualization	REV	CORE2014	B	No	802		
1521	International Workshop on Requirements Engineering: Foundation for Software Quality	REFSQ	CORE2014	B	Yes	803		
1522	International Workshop on Research Issues in Data Engineering	RIDE	CORE2014	B	No	804		
1525	International Workshop on Security	IWSEC	CORE2014	B	No	803		
1531	International Workshop on Software Process Simulation and Modelling (now ICSP)	PROSim	CORE2014	B	No	803		
1542	International Workshop on Web Content Caching and Distribution	WCW	CORE2014	B	No	806		
1546	International Workshops on Enabling Technologies: Infrastructures for Collaborative Enterprises	WETICE	CORE2014	B	No	801		
1547	International Workshops on First-Order Theorem Proving	FTP	CORE2014	B	No	802		
958	Joint Conference on Computer Vision, Imaging and Computer Graphics Theory and Applications (GRAPP and VISAPP combined from 2008)	VISIGRAPP	CORE2014	B	Yes	801		
1574	Joint Modular Languages Conference	JMLC	CORE2014	B	No	803		
1576	Joint workshop on Multimodal Interaction and Related Machine Learning Algorithms (now ICMI-MLMI)	MLMI	CORE2014	B	No	801		
1588	Language Descriptions, Tools and Applications	LDTA	CORE2014	B	No	803		
1595	Logic and Engineering of Natural Language Semantics	LENLS	CORE2014	B	No	801		
1597	Logical Foundations of Computer Science	LFCS	CORE2014	B	No	802		
1599	Machine Translation Summit	MT SUMMIT	CORE2014	B	No	801		
1603	Massively Parallel Processing Using Optional Interconnections	MPPOI	CORE2014	B	No	805		
1605	Mathematics of Program Construction	MPC	CORE2014	B	No	802		
1606	Mechatronics and Machine Vision in Practice	M2VIP	CORE2014	B	No	910		
1608	Medicine Meets Virtual Reality	MMVR	CORE2014	B	No	801	903	
1658	Pacific Asia Conference on Language, Information and Computation	PACLIC	CORE2014	B	No	801		
1659	Pacific Asian Conference on Expert Systems	PACES	CORE2014	B	No	801		
1661	Pacific Rim International Conference on Artificial Intelligence	PRICAI	CORE2014	B	No	801		
1662	Pacific Rim International Symposium on Dependable Computing	PRDC	CORE2014	B	No	805		
1664	Pacific Rim Knowledge Acquisition Workshop	PKAW	CORE2014	B	No	802		
1670	Pacific-Rim Symposium on Image and Video Technology	PSIVT	CORE2014	B	No	801		
1677	Participatory Design Conference	PDC	CORE2014	B	No	806	1203	
1678	Passive and Active Measurement Conference	PAM	CORE2014	B	No	806		
1680	Pattern Languages of Programs	PLOP	CORE2014	B	No	803		
1686	Practical Aspects of Declarative Languages	PADL	CORE2014	B	No	803		
1688	Practice and Theory of Automated Timetabling	PATAT	CORE2014	B	No	802		
1442	Privacy Enhancing Technologies Symposium (was International Workshop of Privacy Enhancing Technologies)	PETS	CORE2014	B	No	803		
1696	Product Focused Software Process Improvement	PROFES	CORE2014	B	Yes	803		
1708	Robot Soccer World Cup	RoboCup	CORE2014	B	No	801		
1710	RSA Conference	RSA	CORE2014	B	No	804		
1196	"RuleML: International Web Rule Symposium (pre 2007 was ""International Conference on Rules and Rule Markup Languages for the Semantic Web"")"	RuleML	CORE2014	B	Yes	806		
957	SIGGRAPH Asia	SA	CORE2014	B	Yes	801		
1734	Singapore International Conference on Intelligent Systems	SPICIS	CORE2014	B	No	801		
1736	SKLOIS Conference on Information Security and Cryptology	Inscrypt	CORE2014	B	No	804		
1737	Smart Card Research and Advanced Application Conference	SCRAA	CORE2014	B	No	1005		
1185	Software Quality, Reliability, and Security (was International Conference on Quality Software, QSIC, that merged with SERE 2015)	QRS	CORE2014	B	No	803		
1744	Software Technology and Engineering Practice Conference	STEP	CORE2014	B	No	803		
1768	Summer Computer Simulation Conference	SCSC	CORE2014	B	No	801		
1774	Symposium on Abstraction, Reformulation and Approximation	SARA	CORE2014	B	No	802		
1777	Symposium on Advances in DB and Information Systems	ADBIS	CORE2014	B	No	804	806	
1784	Symposium on Geometry Processing	SGP	CORE2014	B	No	802		
1788	Symposium on Logical Formalizations of Commonsense Reasoning	COMMONSENSE	CORE2014	B	No	801		
1789	Symposium on Networked Systems, Design and Implementation	NSDI	CORE2014	B	No	805		
2118	Symposium on Programming Language Implementation and Logic Programming	PLILP 	CORE2014	B	No			
2167	Symposium On Usable Privacy and Security	SOUPS	CORE2014	B	Yes	803	806	
1801	Technology of Object-Oriented Languages and Systems	TOOLS	CORE2014	B	No	803		
1802	Testbeds and Research Infrastructures for the Development of Networks and Communities	TridentCom	CORE2014	B	Yes	805		
1811	The organizational semiotics Conference	ORGSEM	CORE2014	B	No	806		
1812	The Theory and Application of Diagrams	DIAGRAMS	CORE2014	B	No	801		
1830	Unconventional Models of Computation	UMC	CORE2014	B	No	802		
1834	Universal Machines and Computations	MCU	CORE2014	B	No	802		
1847	Verification, Model Checking and Abstract Interpretation	VMCAI	CORE2014	B	No	803		
1865	Winter Simulation Conference	WSC	CORE2014	B	No	801		
1869	Workshop on Algorithm Engineering	WAE	CORE2014	B	No	802		
1874	Workshop on Algorithms in Bioinformatics	WABI	CORE2014	B	No	802		
1876	Workshop on Analytic Algorithms and Combinatorics	ANALCO	CORE2014	B	No	802		
1879	Workshop on Approximation and Online Algorithms	WAOA	CORE2014	B	No	802		
1886	Workshop on Combinatorial and Algorithmic Aspects of Networking	CAAN	CORE2014	B	No	802		
1893	Workshop on Constraint Satisfaction for Planning and Scheduling	COPLAS	CORE2014	B	No	802		
2152	Workshop on Distributed Algorithms (DISC since 1998)	WDAG	CORE2014	B	No			
1909	Workshop on Job Scheduling Strategies for Parallel Processing	JSSPP	CORE2014	B	No	805		
1912	Workshop on Logic, Language, Information and Computation	WoLLIC	CORE2014	B	No	802		
1925	Workshop on Power Aware Computing and Systems	HotPower	CORE2014	B	No	803		
1927	Workshop on Programming Languages and Operating Systems	PLOS	CORE2014	B	No	803		
2014	World Conference on Educational Multimedia, Hypermedia and Telecommunications 	ED-MEDIA 	CORE2014	B	No			
1947	World Congress on Expert Systems	WCES	CORE2014	B	No	801		
1948	World Congress on Medical Informatics	MEDINFO	CORE2014	B	No	806		
1949	World Congress on Neural Networks	WCNN	CORE2014	B	No	801		
2151	World Congress on Systems Simulation	WCSS	CORE2014	B	No			
4	3-D Digital Imaging and Modelling	3DIM	CORE2014	C	No	801		
5	A Satellite workshop on Formal Approaches to Testing of Software	FATES	CORE2014	C	No	802		
9	ACIS Conference on Software Engineering Research, Management and Applications	SERA	CORE2014	C	No	803		
10	ACM Annual Computer Science Conference	CSC	CORE2014	C	No	8		
20	ACM Digital Rights Management Workshop	DRM	CORE2014	C	No	803		
21	ACM Information Technology Education	SIGITE	CORE2014	C	No	8		
35	ACM International Workshop On Multimedia Databases	MMDB	CORE2014	C	No	804		
43	ACM SIGIR Workshop on XML and Information Retrieval	SIGIR/XML	CORE2014	C	No	804		
51	ACM SIGPLAN Workshop on Types in Language Design and Implementation (was TIC)	TLDI	CORE2014	C	No	803		
54	ACM SIGUCCS Conference on User Services	SIGUCCS	CORE2014	C	No	899		
1775	ACM Symposium on Access Control Models and Technologies (previously ACM Workshop on Role-Based Access Control, RBAC, changed in 2000)	SACMAT	CORE2014	C	No	802		
62	ACM Symposium on Principles of Database Systems	SPDS	CORE2014	C	No	804		
68	ACM Workshop on Formal Methods in Security Engineering: From Specifications to Code	FMSE	CORE2014	C	No	803		
70	ACM Workshop on Hot Topics in Software Upgrades	HotSWUp	CORE2014	C	No	803		
71	ACM Workshop on Role Based Access Control (now SACMAT)	RBAC	CORE2014	C	No	802		
73	ACM Workshop on Secure Web Services	SWS	CORE2014	C	No	801		
86	ACS/IEEE International Conference on Computer Systems and Applications	AICCSA	CORE2014	C	No	8	12	
87	Active and Real-Time Database Systems	ARTDB	CORE2014	C	No	804		
90	Advanced Course on Artificial Intelligence	ACAI	CORE2014	C	No	801		
91	Advanced Research in VLSI	ARVLSI	CORE2014	C	No	805		
95	Advances in Information Systems	ADVIS	CORE2014	C	No	806		
96	Advances in Intelligent Systems	AIS	CORE2014	C	No	801		
99	Advances in the Theory of Computing	AITC	CORE2014	C	No	802		
105	Algebraic Methodology and Software Technology	AMAST	CORE2014	C	No	802	803	
107	Algorithms and Complexity in Durham	ACID	CORE2014	C	No	802		
110	Ambient Intelligence Developments	Aml.d	CORE2014	C	No	801		
122	Annual Conference of the International Academy for Information Management	IAIM	CORE2014	C	No	806		
125	Annual Conference on Evolutionary Programming	EP	CORE2014	C	No	801		
127	Annual Conference on Privacy, Security and Trust	PST	CORE2014	C	No	804		
128	Annual Convention for Survey, Mapping and Remote Sensing	RS	CORE2014	C	No	909		
129	Annual Fall Workshop on Computational Geometry	CGW	CORE2014	C	No	802		
2106	Annual IASTED International Conference on Networks, Parallel and Distributed Processing and Applications	NPDP	CORE2014	C	Yes			
131	Annual International Conference on Ada	TRI-Ada	CORE2014	C	No	803		
133	Annual Meeting of the Decision Sciences Institute	DSI	CORE2014	C	No	806		
134	Annual PKI R&D Workshop	PKI	CORE2014	C	No	803		
136	Annual Simulation Symposium	ANSS	CORE2014	C	Yes	802		
140	Apple University Consortium Academic and Developers Conference	AUCADC	CORE2014	C	No	899		
143	Applications of Information Visualization	IV-App	CORE2014	C	No	801		
144	Applications of Natural Language to Data Bases	NLDB	CORE2014	C	No	806		
145	Applied Computing Conference	ACC	CORE2014	C	No	8		
146	Applied Perception in Graphics and Visualization	APGV	CORE2014	C	No	801		
148	Argentine Symposium on Artificial Intelligence	ASAI	CORE2014	C	No	801		
1958	Artificial Intelligence and Applications Conference	AIA	CORE2014	C	No			
149	Artificial Intelligence in Knowledge Management	AIKM	CORE2014	C	No	801		
156	Asia Information Retrieval Symposium	AIRS	CORE2014	C	Yes	806	807	
157	Asia International Conference on Modelling and Simulation	AMS	CORE2014	C	No	802		
160	Asia Pacific Conference on Hardware Description Languages (was Asia Pacific CHipDesign Languages)	APCHDL	CORE2014	C	No	1006		
161	Asia Pacific Decision Science Institute Conference	APDSI	CORE2014	C	No	802		
162	Asia Pacific Design Automation Conference	ASDAC	CORE2014	C	No	1006		
164	Asia Pacific Research Symposium on Accounting Information Systems	APRSAIS	CORE2014	C	No	806		
176	Asia-Pacific Computer Human Interaction Conference	APCHI	CORE2014	C	No	1203		
177	Asia-Pacific Conference on Complex Systems	Complex	CORE2014	C	No	801		
183	Asia-Pacific Forum on Engineering and Technology Education	AFETE	CORE2014	C	No	999		
184	Asia-Pacific Network Operations and Management Symposium	APNOMS	CORE2014	C	No	805		
185	Asia-Pacific Services Computing Conference	APSCC	CORE2014	C	Yes	805		
169	Asian International Mobile Computing Conference	AMOC	CORE2014	C	No	805		
170	Asian Symposium on Computer Mathematics	ASCM	CORE2014	C	No	802		
189	Asilomar Conference on Signals, Systems and Computing	ACSSC	CORE2014	C	No	1005		
190	Aspect-Orientation Asia	AO-Asia	CORE2014	C	No	803		
281	Automation of Software Test	AST	CORE2014	C	No	804		
285	Bioinformatics Visualization	BioViz	CORE2014	C	No	801		
288	Body Sensor Networks	BSN	CORE2014	C	No	806		
308	CGAL User Workshop	CGAL	CORE2014	C	No	802		
310	Challenges of Large Applications in Distributed Environments	CLADE	CORE2014	C	No	805		
318	Colloquium on Mathematics and Computer Science: Algorithms, Trees, Combinatorics and Probabilities	MathInfo	CORE2014	C	No	802		
319	Cologne-Twente Workshop on Graphs and Combinatorial Optimization	CTW	CORE2014	C	No	802		
322	Committee on Data for Science and Technology	CODATA	CORE2014	C	No	804		
323	Complex Objects Visualization Workshop	COV	CORE2014	C	No	801		
326	Computability in Europe: Logic and Theory of Algorithms	CiE	CORE2014	C	No	802		
328	Computational Techniques and Applications Conference	CTAC	CORE2014	C	No	802		
329	Computational Topology Workshop	CT	CORE2014	C	No	802		
333	Computer Animation, Information Visualisation, and Digital Effects	CAivDE	CORE2014	C	No	801		
336	Computer Science Research Conference	CSRC	CORE2014	C	No	8		
341	Computing in Education Group of Victoria Conference	CEG	CORE2014	C	No	899		
345	Conference for the International Simulation and Gaming Association	ISAGA	CORE2014	C	No	802		
349	Conference of the Association of Asian-Pacific Operational Research Societies	APORS	CORE2014	C	No	802		
351	Conference of the Commission Internationale pour l'Etude et l'Amelioration de l'Enseignement des Mathematiques	CIEAEM	CORE2014	C	No	802		
353	Conference of the International Society for Decision Support Systems	ISDSS	CORE2014	C	No	801		
356	Conference on Algorithmic Aspects in Information and Management	AAIM	CORE2014	C	No	806		
357	Conference on Algorithms and Hardware for Parallel Processing	CONPAR	CORE2014	C	No	805		
360	Conference on Artificial Neural Networks and Expert systems	ANNES	CORE2014	C	No	801		
362	Conference on Computers, Freedom, and Privacy	CFP	CORE2014	C	No	803		
364	Conference on Discrete Mathematics, Algebra and their Application	DIMA	CORE2014	C	No	802		
366	Conference on Graph Theory and Discrete Geometry	CGTDG	CORE2014	C	No	802		
368	Conference on Information Sciences and Systems	CISS	CORE2014	C	No	806		
372	Conference on Office Information Systems	SIGOA	CORE2014	C	No	806		
375	Conference on Orders, Algorithms and Applications	Ordal	CORE2014	C	No	802		
377	Conference on RFID Security	RFIDSec	CORE2014	C	No	803		
379	Conference on Security in Network Architectures and Information Systems	SAR-SSI	CORE2014	C	No	803		
380	Conference on Software Engineering Education and Training (previously Conference is Software Engineering Education, CSEE, changed in 1997)	CSEE&T	CORE2014	C	No	8	9	
385	Conference on Visualization and Data Analysis	VDA	CORE2014	C	No	801		
389	Constraint Databases and Applications	CDB	CORE2014	C	No	804		
390	Constraint Programming Day	CPD	CORE2014	C	No	802		
398	Cooperative Design, Visualization, and Engineering	CDVE	CORE2014	C	No	801		
400	Coordinated and Multiple Views in Exploratory Visualization	CMV	CORE2014	C	No	801		
402	Cryptography Policy and Algorithms Conference	CryPAC	CORE2014	C	No	804		
405	Cultural Heritage Knowledge Visualisation	CHKV	CORE2014	C	No	801		
409	Data Semantics in Web Information Systems	DASWIS	CORE2014	C	No	806		
414	Design and Aesthetics in Visualisation	DAViz	CORE2014	C	No	801		
416	Design and Management of Data Warehouses	DMDW	CORE2014	C	No	804		
426	Digital Arts and Culture	DAC	CORE2014	C	No	806		
427	Digital Games Research Conference	DIGRA	CORE2014	C	No	806		
429	DIMACS Workshop on Intrinsic Complexity of Computation	DIMACS Intrinsic	CORE2014	C	No	802		
430	Discourse Anaphora and Anaphor Resolution Colloquium	DAARC	CORE2014	C	No	801		
431	Discrete and Algorithmic Geometry	DAG	CORE2014	C	No	802		
432	Discrete Models: Combinatorics, Computation and Geometry	DM-CCG	CORE2014	C	No	802		
433	Distributed Communities on the Web Workshop	Dcw	CORE2014	C	No	806		
434	Domain - Specific Languages for Software Engineering	DSLSE	CORE2014	C	No	803		
435	Domain Specific Aspect Languages	DSAL	CORE2014	C	No	803		
437	Dutch Computational Geometry Day	DutchCG	CORE2014	C	No	802		
438	Dynamic Graph Workshop	DGW	CORE2014	C	No	802		
443	ECRYPT Workshop on Cryptographic Hash Functions		CORE2014	C	No	804		
444	ECRYPT Workshop on Tools for Cryptanalysis		CORE2014	C	No	804		
447	Embedded Sensor Networks Workshop	Emnets	CORE2014	C	No	1005		
449	Enabling Grids for E-Science European Conference	EGEE	CORE2014	C	No	805		
2016	Engineering Federated Information (Database) Systems 	EFIS/EFDBS 	CORE2014	C	Yes			
452	ENVI and IDL Data Analysis and Visualization Symposium	VISualize	CORE2014	C	No	801		
454	ERATO Conference on Quantum Information Science	EQIS	CORE2014	C	No	802		
458	Euro Virtual Reality	Euro VR	CORE2014	C	No	801		
459	EuroConference on Combinatorics, Graph Theory and Applications	EUroComb	CORE2014	C	No	802		
464	Euromicro Conference on Software Engineering and Advanced Applications	SEAA	CORE2014	C	No	803		
465	Euromicro International Conference on Parallel, Distributed and Network Based Processing	PDP	CORE2014	C	No	805		
469	European Chapter on Combinatorial Optimization	ECCO	CORE2014	C	No	802		
470	European Computing Conference	ECC	CORE2014	C	No	8		
471	European Conference of Information Warfare	ECIW	CORE2014	C	No	806		
472	European Conference on Ambient Intelligence	AmI	CORE2014	C	No	801		
476	European Conference on Computational Learning Theory (Now in COLT)	EuroCOLT	CORE2014	C	No	801		
480	European Conference on e-Government	ECEG	CORE2014	C	Yes	806		
482	European Conference on Information Management and Evaluation	ECIME	CORE2014	C	No	806		
489	European Conference on Operations Research	EURO	CORE2014	C	No	802		
492	European Conference on Research Methodology for Business and Management Studies	ECRM	CORE2014	C	No	806		
493	European Conference on Software Maintenance and Reengineering	CSMR	CORE2014	C	No	803		
495	European Conference on Symbolic and Quantitative Approaches to Reasoning with Uncertainty	ECSQARU	CORE2014	C	No	801		
496	European Conference on Universal Multiservice Networks	ECUMN	CORE2014	C	No	805		
498	European Congress on Intelligent Techniques and Soft Computing	EUFIT	CORE2014	C	No	801		
500	European Institute for Computer Anti-Virus Research EICAR Conference	EICAR	CORE2014	C	No	804		
501	European Lisp Workshop	ELW	CORE2014	C	No	803		
505	European PVM/MPI Users' Group Conference	EuroPVM/MPI	CORE2014	C	No	805		
513	European Symposium on Gender and ICT	ESGICT	CORE2014	C	No	899		
518	European Workshop on Advanced Mobile Robots	EuroBot	CORE2014	C	No	910		
519	European Workshop on Computational Geometry	EuroCG	CORE2014	C	No	802		
520	European Workshop on Modelling Autonomous Agents in a Multi-Agent World	MAAMAW	CORE2014	C	No	801		
521	European Workshop on Multi-Agent Systems	EUMAS	CORE2014	C	No	801		
522	European Workshop on Security and Privacy in Ad -Hoc and Sensor Networks	ESAS	CORE2014	C	No	803		
524	European-Japanese Conference on Information Modelling and Knowledge Bases	EJC	CORE2014	C	No	804		
527	Exploring Modelling Methods in Systems Analysis and Design	EMMSAD	CORE2014	C	No	806		
529	Extreme Markup Languages	Extreme	CORE2014	C	No	803		
534	Finite Differences-Finite Elements-Finite Volumes-Boundary Elements	F-and-B	CORE2014	C	No	801		
535	FIRA Robot World Congress	FIRA	CORE2014	C	No	910		
537	Flexible Query-Answering Systems	FQAS	CORE2014	C	No	801		
539	Formal and Computational Cryptography	FCC	CORE2014	C	No	804		
541	Formal Methods in Software Engineering and Defence Systems Workshop	FMSEDS	CORE2014	C	No	803		
542	Formal Methods Pacific	FMP	CORE2014	C	No	802		
544	Forum on Specification, Verification and Design Languages	FDL	CORE2014	C	No	804		
545	Foundations of Aspect-Oriented Languages	FOAL	CORE2014	C	No	803		
553	Functional and Declarative Programming in Education	FDPE	CORE2014	C	No	803		
555	Game Developers Conference	GDC	CORE2014	C	No	806		
559	Geometry Festival: An international workshop on Discrete Geometry and Rigidity	GeomFest	CORE2014	C	No	802		
562	GeoVisualization and Information Visualization	GeoViz	CORE2014	C	No	801		
565	GI International Conference on Detection of Intrusions and Malware, and Vulnerability Assessment	DIMVA	CORE2014	C	Yes	803		
566	GIS Planet Conference	GISPlanet	CORE2014	C	No	806		
567	Global Chinese Conference on Computers in Education	GCCCE	CORE2014	C	No	899		
571	Grace Hopper Celebration of Women in Computing	GHC	CORE2014	C	No	899		
574	Haskell Workshop	HASKELL	CORE2014	C	No	803		
581	High-Performance Grid Computing Workshop (part of IPDPS Conference)	HPGrid	CORE2014	C	No	805		
584	Human System Interaction	HIS	CORE2014	C	No	806		
2036	IADIS International Conference Applied Computing	IADIS AC 	CORE2014	C	No			
2089	IASTED International conference Law and Technology	LawTech 	CORE2014	C	Yes			
1957	IASTED International Conference on Applied Informatics	AI	CORE2014	C	Yes			
1977	IASTED International Conference on Applied Simulation and Modelling	ASM	CORE2014	C	Yes			
1975	IASTED International Conference on Artificial Intelligence and Soft Computing	ASC	CORE2014	C	Yes			
1986	IASTED International Conference on Computers and Advanced Technology in Education 	CATE 	CORE2014	C	Yes			
2080	IASTED International Conference on Intelligent Systems and Control	ISC	CORE2014	C	Yes			
2070	IASTED International Conference on Internet, Multimedia Systems and Applications	IMSA	CORE2014	C	Yes			
2101	IASTED International Conference on Modelling and Simulation	MS	CORE2014	C	Yes			
2096	IASTED International Conference on Modelling, Identification, and Control	MIC	CORE2014	C	Yes			
1141	IASTED International Conference on Modelling, Simulation and Optimisation	ICMSO	CORE2014	C	Yes	801		
2113	IASTED International Conference on Parallel and Distributed Computing and Networks 	PDCN 	CORE2014	C	Yes			
2114	IASTED International Conference on Parallel and Distributed Computing and Systems 	PDCS 	CORE2014	C	Yes			
2122	IASTED International Conference on Robotics and Manufacturing	RM	CORE2014	C	Yes			
2133	IASTED International Conference on Signal and Image Processing 	SIP 	CORE2014	C	Yes			
2125	IASTED International Conference on Software Engineering 	SE 	CORE2014	C	Yes			
2126	IASTED International Conference on Software Engineering and Applications 	SEA 	CORE2014	C	Yes			
