1156	International Conference on Next Generation Web Services Practices	NWESP	CORE2014	C	No	806		
2109	International Conference on Object Oriented Information Systems	OOIS	CORE2014	C	No			
374	International Conference on Operations Research	GOR	CORE2014	C	No	802		
1160	International Conference on Optimization: Techniques And Applications	ICOTA	CORE2014	C	No	802		
1161	International Conference on Pairing-based Cryptography	Pairing	CORE2014	C	No	804		
1168	International Conference on Parallel Processing and Applied Mathematics	PPAM	CORE2014	C	No	805		
1172	International Conference on Pervasive Computing and Applications	ICPCA	CORE2014	C	No	805		
1173	International Conference on Pervasive Services	ICPS	CORE2014	C	No	805		
1179	International Conference on Probability, Statistics and Operational Research	PSOR	CORE2014	C	No	802		
1187	International Conference on Recent Advances in Information Technology and Applications	RAITA	CORE2014	C	No	8		
1188	International Conference on Recent Advances in Natural Language Processing	RANLP	CORE2014	C	No	801		
1189	International Conference on Relational Methods in Computer Science	RelMiCS	CORE2014	C	No	802		
1190	International Conference on Relations, Orders and Graphs: Interaction with Computer Science	ROGICS	CORE2014	C	No	802		
1193	International Conference on Risks and Security of Internet and Systems	CRiSIS	CORE2014	C	No	803		
1194	International Conference on Robotics	ROVPIA	CORE2014	C	No	910		
1932	International Conference on Runtime Verification (was workshop pre 2010)	RV	CORE2014	C	No	803		
1200	International Conference on Security of Information and Networks	SIN	CORE2014	C	No	803		
1201	International Conference on Semantic and Digital Media Technologies	SAMT	CORE2014	C	No	806		
1202	International Conference on Semantics Knowledge and Grid	SKG	CORE2014	C	No	806		
1210	International Conference on Software Engineering Advances	ICSEA	CORE2014	C	No	803		
1213	International Conference on Software Engineering Theory and Practice	SETP	CORE2014	C	No	803		
1214	International Conference on Software Engineering, Artificial Intelligence, Networking and Parallel/Distributed Computing	SNPD	CORE2014	C	No	8		
1219	International Conference on Software Quality Management	SQM	CORE2014	C	No	803		
1221	International Conference on Software Testing, Verification and Validation	ICST	CORE2014	C	Yes	803		
1223	International Conference on Spoken Language Processing	ICSLP	CORE2014	C	No	801		
1229	International Conference on Systems Engineering	ISCEng	CORE2014	C	No	803		
1230	International Conference on Systems Research, Informatics and Cybernetics	ICSRIC	CORE2014	C	No	806		
1231	International Conference on Systems Thinking in Management	STM	CORE2014	C	No	806		
1232	International Conference on Technology and Business Management	ICTBM	CORE2014	C	No	806		
2141	International Conference on Technology Education	TE	CORE2014	C	No			
1238	International Conference on the Foundations of Digital Games	FDG	CORE2014	C	No	801		
1241	International Conference on the Statistical Analysis of Textual Data	JADT	CORE2014	C	No	804		
1247	International Conference on Theoretical and Mathematical Foundations of Computer Science	TMFCS	CORE2014	C	No	802		
1249	International Conference on Theory and Applications of Computational Science	TACS	CORE2014	C	No	802		
1252	International Conference on Trust Management	iTrust	CORE2014	C	No	803		
1255	International Conference on Unconventional Computation	UC	CORE2014	C	No	802		
1265	International Conference on Vision Theory and Applications (Joined with GRAPP from 2008)	VISAPP	CORE2014	C	No	801		
1266	International Conference on Visual Information Systems	VISUAL	CORE2014	C	No	801	806	
1267	International Conference on VLSI Design	VLSID	CORE2014	C	No	1005		
1270	International Conference on Web Information Systems and Technologies	WEBIST	CORE2014	C	Yes	806		
1272	International Conference on Web-Age Information Management	WAIM	CORE2014	C	No	806		
1273	International Conference on Web-based Modelling and Simulation	WebSim	CORE2014	C	No	801	805	
1277	International Conference on Worldwide Computing and Its Applications	WWCA	CORE2014	C	No	899		
1278	International Conference Software and Systems Engineering and their Applications	ICSSEA	CORE2014	C	No	803		
1284	International Congress of Chinese Mathematicians	ICCM	CORE2014	C	No	802		
1286	International Congress of Mathematicians	ICM	CORE2014	C	No	802		
1288	International Congress on Computational and Applied Mathematics	ICCAM	CORE2014	C	No	802		
1291	International Congress on Modelling and Simulation	MODSIM	CORE2014	C	No	801		
1296	International CSI Computer Conference	CSICC	CORE2014	C	No	802		
2066	International Federation of Automatic Control World Congress	IFAC	CORE2014	C	No			
1300	International Forum on Applied Wearable Computing	IFAWC	CORE2014	C	No	806		
1301	International French Speaking Conference on Logic and Constraint Programming	JFPLC	CORE2014	C	No	802		
1308	International ICSC Congress on Intelligent Systems and Applications	IICISA	CORE2014	C	No	801		
1309	International IEEE Security in Storage Workshop	SISW	CORE2014	C	No	803		
1310	International IEEE Workshop on Software Evolvability	SE	CORE2014	C	No	803		
1312	International Joint Conference CAAP/FASE on Theory and Practice of Software Development	TAPSOFT	CORE2014	C	No	803		
1315	International Joint Conference on e-Business and Telecommunications	ICETE	CORE2014	C	No	806		
1316	International Joint Conference on Knowledge Discovery, Knowledge Engineering and Knowledge Management	IC3K	CORE2014	C	No	8	10	
1195	International Joint Conference on Rough Sets (2014 International Conference on Rough Sets and Current Trends in Computing joined with 3 others)	IJCRS (was RSCTC)	CORE2014	C	No	801		
1320	International KES Symposium on Agents and Multiagent systems - Technologies and Applications	KES AMSTA	CORE2014	C	No	801		
1321	International Machine Vision and Image Processing Conference	IMVIP	CORE2014	C	No	801		
1329	International Network Optimization Conference	INOC	CORE2014	C	No	802		
1330	International Parallel Computing Workshop	PCW	CORE2014	C	No	805		
1331	International Picture Coding Symposium	PCS	CORE2014	C	No	1005		
1335	International Python Conference	IPythC	CORE2014	C	No	803		
1343	International Symposium on 3D Data Processing Visualization and Transmission	3DPVT	CORE2014	C	No	801		
1350	International Symposium on Applications and the Internet	SAINT	CORE2014	C	No	899		
1352	International Symposium on Applied Computational Intelligence and Informatics	SACI	CORE2014	C	No	801		
1353	International Symposium on Applied Machine Intelligence and Informatics	SAMI	CORE2014	C	No	801		
1355	International Symposium on Artificial Life and Robotics	AROB	CORE2014	C	No	801		
1356	International Symposium on Audio, Video, Image Processing and Intelligent Applications	ISAVIIA	CORE2014	C	No	801		
1358	International Symposium on Automation and Robotics in Construction	SARC	CORE2014	C	No	910		
1359	International Symposium on Autonomous Decentralized Systems	ISADS	CORE2014	C	No	805		
1361	International Symposium on Circuits and Systems	CIRSYS	CORE2014	C	No	1006		
1363	International Symposium on Collaborative Technologies and Systems	CTS	CORE2014	C	No	805		
1364	International Symposium on Combinatorial Optimisation	CO	CORE2014	C	No	802		
1369	International Symposium on Computer and Information Sciences	ISCIS	CORE2014	C	No	806		
1371	International Symposium on Computer Design	COMPDES	CORE2014	C	No	1005		
1372	International Symposium on Cooperative Database Systems for Advanced Applications	CODAS	CORE2014	C	No	804		
1373	International Symposium on Data, privacy and E-Commerce	ISDPE	CORE2014	C	No	803		
1380	International Symposium on Foundations of Intelligent Systems	ISMIS	CORE2014	C	No	801		
1384	International Symposium on Future Software Technology	ISFST	CORE2014	C	No	803		
1385	International Symposium on Grid Computing	ISGC	CORE2014	C	No	805		
1387	International Symposium on Information and Communication Technologies	ISICT	CORE2014	C	No	8		
1388	International Symposium on Information Assurance and Security	IAS	CORE2014	C	No	804		
1389	International Symposium on Information Processing	ISIP	CORE2014	C	No	806		
1391	International Symposium on Innovations in Intelligent Systems and Applications	INISTA	CORE2014	C	No	801		
1392	International Symposium on Intelligent and Interactive Multimedia: Systems and Services	KES IIMSS	CORE2014	C	No	806		
1393	International Symposium on Intelligent Multimedia, Video and Speech Processing	ISIMP	CORE2014	C	No	1006		
1394	International Symposium on Intelligent Systems and Informatics	SISY	CORE2014	C	No	806		
1396	International Symposium on Leveraging Applications of Formal Methods, Verification and Validation	ISoLA	CORE2014	C	No	802		
1402	International Symposium on Neural Networks	ISNN	CORE2014	C	No	801		
1403	International Symposium on Next Generation Data Base Systems and Applications	NGDB	CORE2014	C	No	804		
1404	International Symposium on Object Technologies for Advanced Software	ISOTAS	CORE2014	C	No	803		
1405	International Symposium on Parallel and Distributed Computing	ISPDC	CORE2014	C	No	805		
2117	International Symposium on Physical Design	PHYSDES 	CORE2014	C	No			
1413	International Symposium on Spatial Data Handling	SDH	CORE2014	C	No	804	1205	
1414	International Symposium on Spatial Data Infrastructures	ISSDI	CORE2014	C	No	909		
1415	International Symposium on Spatial Data Quality	ISSDQ	CORE2014	C	No	909		
1421	International Symposium on Symbolic and Numeric Algorithms for Scientific Computing	SYNASC	CORE2014	C	No	802		
1423	International Symposium on Technology and Society	ISTAS	CORE2014	C	No	899		
1425	International Symposium on the Mathematical Theory of Networks and Systems	MTNS	CORE2014	C	No	805		
1427	International Symposium on Theoretical Aspects of Software Engineering	TASE	CORE2014	C	No	803		
1429	International Symposium on Visual Computing	ISVC	CORE2014	C	No	801		
1430	International Symposium on Voronoi diagrams in Science and Engineering	ISVD	CORE2014	C	No	802		
1436	International Visualization in Transportation Symposium and Workshop	TRB Viz	CORE2014	C	No	801		
1437	International Web Conference	IWC	CORE2014	C	No	806		
1439	International Wordnet Conference (Global Wordnet Conference)	GWC	CORE2014	C	No	804		
1441	International Workshop in Software Measurement (Joined with Mensura from 2007)	IWSM	CORE2014	C	No	804		
1443	International Workshop of the Initiative for the Evaluation of XML Retrieval	INEX	CORE2014	C	No	803		
1444	International Workshop on Abstract State Machines	ASM(W)	CORE2014	C	No	802		
1445	International Workshop on Advanced Architectures and Algorithms for Internet Delivery and Applications	AAA-IDEA	CORE2014	C	No	806		
1448	International Workshop on Algorithms and Computation	WALCOM	CORE2014	C	No	802		
1449	International Workshop on Aliasing, Confinement and Ownership	IWACO	CORE2014	C	No	803		
1452	International Workshop on Boolean Functions: Cryptography and Applications	BFCA	CORE2014	C	No	804		
1453	International Workshop on Business Process Design	BPD	CORE2014	C	No	806		
1454	International Workshop on Business Process Intelligence	BPI	CORE2014	C	No	806		
1455	International Workshop on Business Process Modelling, Development, and Support	BPMDS	CORE2014	C	No	806		
1456	International Workshop on C# and .NET Technologies	C#	CORE2014	C	No	803		
1458	International Workshop on Combinations of Intelligent Methods and Applications	CIMA	CORE2014	C	No	801		
1460	International Workshop on Combinatorial Image Analysis: Theory and Applications	IWCIA	CORE2014	C	No	802		
1461	International Workshop on Comparative Evaluation in Requirements Engineering	CERE	CORE2014	C	No	803		
1463	International Workshop on Critical Information Infrastructures Security	CRITIS	CORE2014	C	No	803		
1465	International Workshop on Developments in Computational Models	DCM	CORE2014	C	No	802		
1466	International Workshop on Digital Watermarking	IWDW	CORE2014	C	No	802	804	
1467	International Workshop on Distributed Object Management	IWDOM	CORE2014	C	No	803		
1468	International Workshop on Domain Driven Data Mining	DDDM	CORE2014	C	No	804		
1469	International Workshop on Economics-Driven Software Engineering Research	EDSER	CORE2014	C	No	803		
1471	International Workshop on Enterprise and Organizational Modelling and Simulation	EOMAS	CORE2014	C	No	806		
1473	International Workshop on Entertainment Computing	WEC	CORE2014	C	No	806		
1474	International Workshop on Evolution and Change in Data Management	ECDM	CORE2014	C	No	804		
1476	International Workshop on Formal Methods for interactive Systems	FMIS	CORE2014	C	No	806		
1477	International Workshop on Formal Methods for Parallel Programming: Theory and Applications	FMPPTA	CORE2014	C	No	802		
1479	International Workshop on Foundations of Models and Languages for Data and Objects	FMLDO	CORE2014	C	No	804		
1480	International Workshop on Foundations of Object-Oriented Languages	FOOL	CORE2014	C	No	803		
1481	International Workshop on Functional and (Constraint) Logic Programming	WFLP	CORE2014	C	No	802		
1482	International Workshop on Genetic and Evolutionary Fuzzy Systems	GEFS	CORE2014	C	No	801		
1483	International Workshop on Global Optimization	GO	CORE2014	C	No	802		
1485	International Workshop on Group-Oriented Cryptographic Protocols	GOCP	CORE2014	C	No	804		
1486	International workshop on High-Level Parallel Programming and Applications	HLPP	CORE2014	C	No	805		
1487	International Workshop on High-Level Parallel Programming Models and Supportive Environments	HIPS	CORE2014	C	No	805		
1489	International Workshop on Hot topics in Peer-to-Peer Systems	HotP2P	CORE2014	C	No	805		
1490	International Workshop on Human Aspects in Ambient Intelligence: Agent Technology, Human-Oriented Knowledge and Applications	HAI	CORE2014	C	No	801		
1491	International Workshop on Image Analysis and Information Fusion	IAIF	CORE2014	C	No	801		
1492	International Workshop on Incorporating COTS Software into Software Systems, Tools and Techniques	IWICSS	CORE2014	C	No	804		
1494	International Workshop on Information Security Applications	WISA	CORE2014	C	No	803		
1495	International Workshop on Intelligent Agents	IWIA	CORE2014	C	No	801		
1496	International Workshop on Interactive Entertainment	IDET	CORE2014	C	No	806		
1497	International Workshop on Issues in the Theory of Security	WITS	CORE2014	C	No	803		
1498	International Workshop on Knowledge Discovery from Data Streams	IWKDDS	CORE2014	C	No	801		
1499	International Workshop on Logic and Complexity in Computer Science	LCCS	CORE2014	C	No	802		
1500	International Workshop on Metamodelling - Utilization in Software Engineering	MUSE	CORE2014	C	No	803		
1501	International Workshop on Middleware for Grid Computing	MGC	CORE2014	C	No	805		
1502	International Workshop on Mobile Commerce and Services	WMCS	CORE2014	C	No	806		
1503	International Workshop on Modelling and Visualization of XML and Semantic Web Data	MOVIX	CORE2014	C	No	804		
1504	International Workshop on Modelling in Software Engineering	MISE	CORE2014	C	No	803		
1505	International Workshop on Modelling, Simulation, Verification and Validation of Enterprise Information Systems	MSVVEIS	CORE2014	C	No	806		
1506	International Workshop on MultiAgent Based Simulation	MABS	CORE2014	C	No	801		
1507	International Workshop on Multimedia Data Storage, Retrieval, Integration and Applications	MDSRIA	CORE2014	C	No	806		
1509	International Workshop on Nonmonotonic Reasoning, Action and Change	NRAC	CORE2014	C	No	801		
1513	International Workshop on Pattern Recognition in Information Systems	PRIS	CORE2014	C	No	806		
1514	International Workshop on Post-Quantum Cryptography	PQCrypt	CORE2014	C	No	804		
1517	International Workshop on Quality of Information Systems	QOIS	CORE2014	C	No	806		
1519	International Workshop on Realising Evidence-based Software Engineering	REBSE	CORE2014	C	No	803		
1524	International Workshop on Schema Languages for XML	X-Schemas	CORE2014	C	No	803		
1526	International Workshop on Security in Information Systems	WOSIS	CORE2014	C	No	803		
1527	International Workshop on Security Protocols	IWSP	CORE2014	C	No	803		
1528	International Workshop on Soft Computing Applications	SOFA	CORE2014	C	No	801		
1530	International Workshop on Software Engineering for High Performance Computing Applications	SE-HPC	CORE2014	C	No	805		
1532	International Workshop on Software Product Management	IWSPM	CORE2014	C	No	803		
1533	International Workshop on Software Quality	WoSQ	CORE2014	C	No	804		
1534	International Workshop on Software Technology for Augmented Reality Systems	IWSTAR	CORE2014	C	No	806		
1535	International Workshop on Temporal Databases	TDB	CORE2014	C	No	804		
1536	International Workshop on the Algorithmic Foundations of Robotics	WAFR	CORE2014	C	No	802		
1537	International Workshop on the Sate of the Art in Cryptology and New Challenges Ahead	Quo Vadis Cryptology	CORE2014	C	No	804		
1538	International Workshop on the Web and Databases	WebDB	CORE2014	C	No	806		
1539	International Workshop on Ubiquitous Virtual Reality	IWUVR	CORE2014	C	No	801		
1540	International Workshop on Visualization for Cyber Security	VizSec	CORE2014	C	No	803		
1541	International Workshop on Web and Wireless Geographical Information Systems	W2GIS	CORE2014	C	No	909		
1543	International Workshop on Web Information Systems Modelling	WISM	CORE2014	C	No	806		
1549	International XML Database Symposium	Xsym	CORE2014	C	No	804		
1550	Internationale Tagung Wirtschaftsinformatik	DITW	CORE2014	C	No	806		
1552	Internet Research	AOIR	CORE2014	C	No	806		
1553	Internet Society Conference	INET	CORE2014	C	No	806		
1554	Interoperating Geographic Information Systems	INTEROP	CORE2014	C	No	806		
1555	INTUITION International Conference	INTUITION	CORE2014	C	No	801		
1340	ISC High Performance (was International Supercomputing Conference)	ISC	CORE2014	C	No	805		
1556	ISCA International Conference on Computer Applications in Industry and Engineering	CAINE	CORE2014	C	No	8		
1557	ISCA Tutorial and Research Workshop Automatic Speech Recognition	ASR	CORE2014	C	No	801		
2115	Joint AUPEC & EECON 	PEC&CON 	CORE2014	C	No			
1218	Joint Conference of the International Workshop on Software Measurement and the International Conference on Software Process and Product Measurement (IWSM and Mensura combined from 2007)	IWSM Mensura	CORE2014	C	No	804		
1970	Joint Conference on Declarative Programming APPIA-GULP-PRODE	APPIA/GULP/PRODE	CORE2014	C	No			
1568	Joint Conference on Information Sciences	JCIS	CORE2014	C	No	806		
1569	Joint Conference on New Methods in Language Processing and Computational Natural Language Learning	NeMLaP	CORE2014	C	No	801		
1570	Joint European Conference and Exhibition on Geographical Information Systems	JECGI	CORE2014	C	No	909		
1572	Joint International Conference on CyberGames and Interactive Entertainment	CGIE	CORE2014	C	No	806		
2017	Joint Meeting of the European Frequency and Time Forum and the Institute of Electrical and Electronics Engineers In	EFTF/IFCS	CORE2014	C	No			
2108	Joint OECC, IOCC & ACOFT	OESS/IOCC/ACOFT	CORE2014	C	No			
1575	Joint Working Conference on Secure Information Networks: Communications and Multimedia Security	CMS	CORE2014	C	No	803		
1577	Journal of Computing Science in Colleges (Conference proceedings)	CCSC	CORE2014	C	Yes	899		
1579	KES International Symposium on Intelligent Decision Technologies	KES IDT	CORE2014	C	No	801		
1580	Knowledge Acquisition, Modelling and Management Workshop (No longer Exists)	KAW	CORE2014	C	No	806		
1581	Knowledge and Data Engineering Exchange Workshop	KDEX	CORE2014	C	No	804		
1583	Knowledge Discovery and Data Mining in Biological Databases Meeting	KDDMBD	CORE2014	C	No	804		
1584	Knowledge Domain Visualisation	KDViz	CORE2014	C	No	801		
1585	Knowledge Representation Meets Databases	KRDB	CORE2014	C	No	804		
1586	Knowledge Visualization and Visual Thinking	KV	CORE2014	C	No	801		
1587	Kyoto International Conference on Computational Geometry and Graph Theory	KyotoCGGT	CORE2014	C	No	802		
2092	Language Resources and Evaluatin Conference	LREC	CORE2014	C	No			
1593	Law via the Internet	LI	CORE2014	C	No	899		
1594	Lexical Semantics and Knowledge Representation	SIGLEX	CORE2014	C	No	804		
1600	Machine Vision Applications	MVA	CORE2014	C	No	801		
1601	MACIS: International Conference of Mathematical Aspects of Computer and Information Sciences	MACIS	CORE2014	C	No	802		
1604	Mathematical Methods in Computer Science	MMICS	CORE2014	C	No	802		
1611	Mexican International Conference on Current Trends in Computer Science (was Mexican International Conference on Computer Science)	ENC	CORE2014	C	No	8		
1614	Mining for Enhanced Web Search	MEWS	CORE2014	C	No	806		
1617	Mobility in Databases and Distributed Systems	MDDS	CORE2014	C	No	804		
1618	Modelling and Optimization: Theory and Applications	MOPTA	CORE2014	C	No	802		
1621	MSRI Combinatorial Game Theory Research Workshop	GameTheory	CORE2014	C	No	802		
1622	Multimedia Content Access: Algorithms and Systems (was Multimedia Content Analysis, Management and Retrieval)	MCA:AS	CORE2014	C	No	806		
2100	Multiple Objective Decision Support System Conference	MODSS	CORE2014	C	No			
1625	NAISO Congress on Autonomous Intelligent Systems	NAISO	CORE2014	C	No	801		
1637	Natural Language Processing and Knowledge Engineering	IEEE NLP-KE	CORE2014	C	No	801		
1642	New Security Paradigms Workshop	NSPW	CORE2014	C	No	804		
1643	New Zealand Game Developers Conference	FUSE	CORE2014	C	No	806		
1653	Onward Software Engineering	Onward	CORE2014	C	No	803		
1654	Optimal Discrete Structures and Algorithms	ODSA	CORE2014	C	No	802		
1655	Optimization: Techniques And Applications	OTA	CORE2014	C	No	802		
1656	Organisations and Society in Information Systems Workshop	OASIS	CORE2014	C	No	806		
2111	PACES & ICIL	P&I	CORE2014	C	No			
1666	Pacific Symposium on Biocomputing	PSB	CORE2014	C	No	803		
1668	Pacific-Asia Workshop on Electronic Commerce	PAWEC	CORE2014	C	No	806		
1669	Pacific-Rim Conference on Multimedia	PCM	CORE2014	C	No	801		
1671	Pan Pacific Conference on Information Systems	PPCIS	CORE2014	C	No	806		
1672	Pan-Sydney Area Workshop on Visual Information Processing	VIP	CORE2014	C	No	801		
1673	Parallel and Distributed Information Systems	PDIS	CORE2014	C	No	805		
1674	Parallel Computing	PARCO	CORE2014	C	No	805		
1685	Practical Application of Intelligent Agents and Multi-Agent Technology Conference	PAAM	CORE2014	C	No	801		
1687	Practical Aspects of PROLOG/Constraint Technology	PAP/PACT	CORE2014	C	No	802		
1689	Practices of Linking Aspect Technology and Evolution	PLATE	CORE2014	C	No	803		
1690	Prague Stringology Conference	PSC	CORE2014	C	No	803		
1693	Privacy in Statistical Databases	PSD	CORE2014	C	No	804		
1695	Processing Declarative Knowledge, International Workshop	PDK	CORE2014	C	No	803		
1697	Program Visualization Workshop	PVW	CORE2014	C	No	801		
1698	Programming Language Techniques for XML	PLAN-X	CORE2014	C	No	803		
1702	Reflection, AOP and Meta-Data for Software Evolution	RAM-SE	CORE2014	C	No	803		
1703	Relationships and Associations in Object-Oriented Languages	RAOOL	CORE2014	C	No	803		
1705	Richard Tapia Celebration of Diversity in Computing Conference	Tapia	CORE2014	C	No	8		
1717	Search: Workshop on Search, Sorting and Coding	Search	CORE2014	C	No	802		
138	Selected Areas in Cryptography	SAC	CORE2014	C	Yes	804		
1720	Semantic Web Visualisation	VSW	CORE2014	C	No	801		
1721	Sensor Networks	Sensor Networks	CORE2014	C	No	1006		
1722	Service Oriented Computing: Consequences for Engineering Requirements	SOCCER	CORE2014	C	No	803		
1723	SGAI International Conference on Artificial Intelligence	SGAI	CORE2014	C	No	801		
1724	SIAM Conference on Discrete Mathematics	DM	CORE2014	C	No	802		
1725	SIAM Conference on Geometric Design	GeoD	CORE2014	C	No	802		
1726	SIAM Conference on Optimization	OP	CORE2014	C	No	802		
1728	SIAM Workshop on Algorithms for Listing, Counting, and Enumeration	ALICE	CORE2014	C	No	802		
1729	SIGdial Workshop on Discourse and Dialog	SIGdial	CORE2014	C	Yes	899		
1731	SIGIR workshop: Stylistic Analysis of Text For Information Access	Style	CORE2014	C	No	806		
1732	SIGOPT - International Conference on Optimization	ICO	CORE2014	C	No	802		
1733	Simulation Technology and Training Conference	SimTecT	CORE2014	C	No	801		
2134	Society for Information Technology and Teacher Education Conference 	SITE 	CORE2014	C	No			
1739	Soft Computing in Computer Graphics, Imaging, and Vision	SCCGIV	CORE2014	C	No	801		
1740	Software Education Conference	SRIG-ET	CORE2014	C	No	899		
1742	Software Performance Enhancement for Encryption and Decryption	SPEED	CORE2014	C	No	804		
1743	Software Quality Conference	SQC	CORE2014	C	No	803		
1746	South African International Graph Theory Conference	SAIGTC	CORE2014	C	No	802		
1747	Southeastern International Conference on Combinatorics, Graph Theory, and Computing		CORE2014	C	No	802		
1751	Spatial Information Research Centre Colloquium	SIRC	CORE2014	C	No	909		
1752	Spatial Information Science and Technology Conference	SIST	CORE2014	C	No	909		
1753	Special-purpose Hardware for Attacking Cryptographic Systems	SHARCS	CORE2014	C	No	804		
1754	SPIE Conference on Performance and Control of Network Systems	PCNS	CORE2014	C	No	1006		
1755	SPIE Conference on Visual Data Exploration and Analysis	VDEA	CORE2014	C	No	804		
1756	SPIE International Conference on Multimedia Storage and Archiving Systems	MSAS	CORE2014	C	No	804		
1759	Spring Conference on Computer Graphics	SCCG	CORE2014	C	No	801		
1762	State of the Art of Stream Ciphers	SASC	CORE2014	C	No	804		
1764	Stochastic Local Search Algorithms	SLS	CORE2014	C	No	802		
1765	Storage and Retrieval for Media Databases (was Storage and Retrieval for Image and Video Databases)	SRMD	CORE2014	C	No	804		
1769	Summer School on Modelling and Verification of Parallel Processes	MOVEP	CORE2014	C	No	805		
1772	Symposium of Asian Association for Algorithms and Computation	AAAC	CORE2014	C	No	802		
1778	Symposium on Assessment of Quality S/W Dev Tools	AQSDT	CORE2014	C	No	803		
1779	Symposium on Cellular Automata	JAC	CORE2014	C	No	802		
